documento,topico
virginamerica realli aggress blast obnoxi entertain guest face amp littl recours,11
virginamerica realli big bad thing,10
virginamerica serious would pay 30 flight seat didnt play realli bad thing fli va,3
virginamerica sfopdx schedul still mia,10
virginamerica flew nyc sfo last week couldnt fulli sit seat due two larg gentleman either side help,16
virginamerica first fare may three time carrier seat avail select,3
virginamerica guy mess seat reserv seat friend guy gave seat away want free internet,3
virginamerica statu match program appli three week call email respons,7
virginamerica happen 2 ur vegan food option least say ur site know wont abl 2 eat anyth next 6 hr fail,10
virginamerica amaz cant get cold air vent vx358 noair worstflightev roast sfotobo,17
virginamerica hi bked cool birthday trip cant add elev caus enter middl name flight book problem,13
virginamerica help left expens headphon flight 89 iad lax today seat 2a one answer lampf number lax,3
virginamerica await return phone call would prefer use onlin selfservic option,0
virginamerica chat support work site,19
virginamerica hey first time flyer next week excit im hard time get flight ad elev account help,8
virginamerica hi im excit 99 lgagtdal deal ive tri 2 book sinc last week amp page never load thx,13
virginamerica call 34 week ago ad 3 flight 2014 elevatethey still havent shown uphelp,2
virginamerica heyyyi guyyyi tri get hour someon call pleas,5
virginamerica hi virgin im hold 4050 minut earlier flight la nyc tonight earlier 1150pm,17
virginamerica everyth fine lost bag,4
virginamerica airlin awesom lax loft need step game 40 dirti tabl floor,5
virginamerica go custom servic anyway speak human asap thank,5
virginamerica cant supp biz travel like southwestair custom servic like jetblu neverflyvirginforbusi,13
virginamerica your best whenev begrudgingli use airlin im delay late flight,11
virginamerica interest fli cancel flight next four flight plannedneverflyvirginforbusi,19
virginamerica disappoint experi share everi busi travel meet neverflyvirgin,1
virginamerica im troubl ad flight wife book elev account help,8
virginamerica site back,19
virginamerica like tv interest video disappoint cancel flightl flight flight went jfk saturday,17
virginamerica land lax hour late flight bag check busi travel friendli nomorevirgin,4
virginamerica websit btw new websit isnt great user experi time anoth redesign,5
virginamerica cant check add bag websit isnt work ive tri desktop mobil,5
virginamerica let 2 scan passeng leav plane told someon remov bag 1st class bin uncomfort,3
virginamerica phone number cant find call flight reserv,5
virginamerica anyon anyth today websit useless one answer phone,5
virginamerica must travel miss flight late flight check bag miss morn appoint lost busi sfo2lax,13
virginamerica how direct flight fllgtsfo unexpect layov vega 4 fuel yet peep next bought vega flight sneaki,14
virginamerica late flight bag check lost busi miss flight apt three peopl flight exp,2
virginamerica call servic line hung awesom sarcasm,16
virginamerica site trip im tri check im get plain text version reluct enter card info,19
virginamerica concern fli plane need delay due tech stop,12
virginamerica use anoth browser 2015 amp brand reput built tech respons doesnt crossbrows compat websit,5
virginamerica flight flight book problem site total folk problem,2
virginamerica like custom servic 40 min delay connect passeng seem long va370,15
virginamerica need chang flight that schedul 9 hour 120 min wait time phone im call intern help,5
virginamerica fail custom check process link tsa precheck,5
virginamerica fidifamili us terribl airlin gave us hotel hotlin number said sorri,12
virginamerica chrysichrys assist yesterday u cancel flightl flight give us hotel hotlin shame,12
virginamerica anoth delay flight likingyoulessandless,2
virginamerica need regist servic dog first class ticket sfo gt dull phone queue hour longer pl advis,16
virginamerica cant book seat flight buy even check creat much anxieti frustrat,3
virginamerica youd think pay extra 100 buck rt luggag might afford hire extra hand sfo lame,1
virginamerica pleas provid statu flight 769 cant imagin time web indic dude weather andor dalla,11
virginamerica paid premium fli across countri cancel flight flight offer check fee upgrad love sad face,3
virginamerica question possibl book seat infant 2 give option want seat,3
virginamerica dont understand need dm give answer damag luggag polici,12
virginamerica mean dont polici destroy luggag,3
virginamerica problem flight book problem web site keep give error contact phone phone 30 minut wait,5
virginamerica reschedul cancel flightl flight onlin chang button grey,5
virginamerica rang wait 35 minut book ticket vendor fix site,19
virginamerica got flight told 450 todaycheck email 450 tomorrow unaccept,2
virginamerica flight lga cancel flight stuck dalla call reschedul told could get flight today12,2
virginamerica dont pair includ red wine white offer redwineisbett,3
virginamerica websit,5
virginamerica site seem littl wonk right may want look tri two browser css,13
virginamerica im disappoint agent design silver statu check line dulles_airport close assist paseng,4
virginamerica normal receiv repli central baggag baggageissu smh,7
virginamerica logan airport wait checkin 9am flight checkin desk open,19
virginamerica congrat got busi ewr sfolax fuck unit fl1289 sfoewr clincher,13
virginamerica appli 2 week ago havent heard back im fli week disappoint,8
virginamerica mani apolog r wors airlin dont even respond cudtom,1
virginamerica shame va make peopl spend money strand citi airlin land jfk reimburs,16
virginamerica bad say take 10 14 day via confirm email inquir 3 week claim 6 8 week,16
virginamerica flight bo gt la tomorrow cancel flightl notif wait time 1 hour rebook anoth airlin,17
virginamerica lot apolog thrown custom seeveri sad thank noth worst airlin ever,1
virginamerica flight stuff wrong noth worst flight ever,1
virginamerica tri book flight guy websit wont let lose busi,5
virginamerica suck,11
virginamerica dmd issu persist,13
virginamerica never recd cancel flightlat notic left w option fli ps drive la red eye mon w kid,3
virginamerica tri book flight amp site,5
virginamerica flight fli boston tomorrow need home cancel flightl flight didnt anyth,12
virginamerica stink flight cancel flight psp jfk notif abil rebook disappoint expect better,17
virginamerica websit im tri check,5
virginamerica seat row 8 dont reclin mention websit soreback,6
virginamerica flight 404 delay 2 hour la due mechan problem handl like pro could toss us free drink,2
virginamerica cancel flight flight today precipit scare,12
virginamerica guy charg 100 reschedul flight cancel flight refus refund what deal,17
virginamerica cant access websit safari iphon 6 seem work mac ipad need iphon add passbook,5
virginamerica mobil site broken show headerelevateusernumofpointsavail 0 number point wont let checkin,19
virginamerica realli look forward flight let know reschedul diehardvirgin,19
virginamerica cancel flight flight vx413 one sec delay airport next cancel flightledgonna email call reschedul,2
virginamerica problem link email checkin thank,7
virginamerica chang anoth airlin get dc today unit abl land dc cost 800 ugh,11
virginamerica look forward first flight today cancel flightl along subsequ one,19
virginamerica gon na deal dalla dc deal dc dalla sad,11
virginamerica hold time call center bit much,0
virginamerica site help,5
virginamerica tri reset password email never arriv help,10
virginamerica reason delay departur vx 413 jfk afternoon,6
virginamerica today flight palm spring ca jfk ny cancel flightl,12
virginamerica css site 404 right pleas fix site unus,19
virginamerica flight 910 vega boston today check onlin bag count didnt regist fix somehow,9
virginamerica hi im tri checkin websit work tri 3 differ browser problem continu,14
virginamerica passeng 7d flt 338 assault shouldnt flown trust he ban crew file report faanew,10
virginamerica current bug websit show select departur citi select destin citi,19
virginamerica luggag sever dentedmiss wheel come baggag claim san luggag agent miranda think wasnt help,12
virginamerica request window seat confirm window got stuck middl seat good way treat silver member,3
virginamerica wtf paid direct flight purpos stop fuel exhaust frequent flier noth inconveni,3
virginamerica someth wrong websit safari iphon,5
virginamerica alreadi check page expir x,19
virginamerica boo refund seat upgrad fee want buy first place,17
virginamerica move seat notic better seat cabin select behind row select disappoint,3
virginamerica alreadi contact central baggag amp sent dm renttherunway charg dress lost suitcas help,3
virginamerica anyth go websit ive get lot error past 30 minut,5
virginamerica virginatlant check flight sfo lax amp told atlant fli club gold get benefit,7
virginamerica husband order three drink via screen never came awesom,4
virginamerica soooo guy go leav seatbelt light flight bare call turbul,8
virginamerica funni stori websit broken miss javascript stylesheet checkin process dislik,14
virginamerica im tri check 1050am ct flight tmm desktop websit work sort cach bug so,11
virginamerica guy know checkin link email broken,7
virginamerica lost luggag 4 day ago flight vx 112 lax iad amp im call everi day responsepleas give back stuff,12
virginamerica flight book problem section websit seem broken chrome might wan na look,2
virginamerica look like broken link asset,10
virginamerica manag itinerari section websit seem broken,2
virginamerica cant check site look like everi time load,19
virginamerica carrier less half price round trip fare stun,6
virginamerica wtf happen pdx late flight march one way sfo 550,3
virginamerica luggag gone ive file paperwork promis callemail still resolut respons central luggag,10
virginamerica request mileag challeng statu sever week ago onlin havent heard back get help,7
virginamerica tri book ticket nyc face super fun broken style dont worri ill keep tri,13
virginamerica appli statu match feb 1 got confirm email day still news though guy drop ball late flightli,4
virginamerica tri checkinbut look like site,19
virginamerica spend birthday night daldca get home,3
virginamerica sent coupl messag email provid avail tri next year cheer,11
virginamerica serious though direct flight sfofll may,13
virginamerica fine alreadi done purchas tri go way go back 3,11
virginamerica realli experi hope 4 ws forc 2 check small carri w noth empti cabin space board,3
virginamerica wjere luggag slow lax,4
virginamerica spoke repres offer solut loyal custom fli virginatlant well,3
virginamerica deepli disappoint birthday promo appli trip book mere day receiv email,7
virginamerica happen direct flight sfofll look may see connect help dontdothistom,13
virginamerica 2d 3d emboss badg patch superior one current use,17
virginamerica vx399 jfk la dirti plane standard,19
virginamerica flight vx399 head la jfk dirtiest va plane ever sad great airlin,19
virginamerica avi rental continu button doesnt work websit book car tri 4 time phone suck,5
virginamerica delay to1030,11
virginamerica current minut 10 hold cust servic need anyth add lap child reserv,10
virginamerica comen bank joke pleas chang noth constant problem bank,19
virginamerica submit statu match request back still havent heard im fli monday look acceler,7
virginamerica im pull hair tri book flight u site doesnt work iphon ipaddont comput help,5
virginamerica get help support ticket 15 day incid 150202000419 thank,10
virginamerica even open laptop seat 4c paid premium let,3
virginamerica seat 4c even open laptop paid extra seat,3
virginamerica fyi infovirginamericacom email address say contact password reset email doesnt exist email bounc,10
virginamerica statu match 2 week gone newsflt next week hope flt count toward requir cust svc help,3
virginamerica websit suck donkey dick thought know best,4
virginamerica crap channel pay watch uk tv,11
virginamerica come dont iphon app still use make wast paper,5
virginamerica back seat entertain system accept credit card apostroph surnam apostrophefail,13
virginamerica vx use 6 lga slot instead 4 today ad au make less like,8
virginamerica sad learn longer fli sfo gt phl hope return,19
virginamerica kinda suck earphon jack didnt work flight may want look futur passeng,16
virginamerica poor experi first comput problem seat malfunct stuck miss meet san diego,2
virginamerica tri offer charg addit 1k new ticket strand thur 1st time last time,13
virginamerica never bad experi one took cake extort carri item well,7
virginamerica spend 5 hour worri item carryon would brokenstolen sinc couldnt carri plane lock bag,3
virginamerica group e told room bin got plane room least 4 bag row,2
virginamerica thank make flight lax jfk nightmar forc check carri bag gate 1,4
virginamerica lot flight book site work ive phone wait 10 minut,5
virginamerica take 12 year fli home dalla get shit togeth,8
virginamerica man steel fli citi thoughand frequenc,6
virginamerica start flight scold use overhead bin offer person seat next,18
virginamerica airlin werent cancel flight flight bo help custom get home virgin say good luck,8
virginamerica group virgin other bo weather expos actual cu serv model never flight book problem virgin,2
virginamerica one travel affect boston storm im shock virgin complet apathi toward custom,5
virginamerica umm reason someon differ contact contact get definit answer,7
virginamerica tri make chang advanc 24 hour priortri onlin earlier want 300 chang fee,5
virginamerica mood light point reclin seat kickin feet,3
virginamerica flight 6000 schedul 1pm departur still say time plane gate updat long delay,2
virginamerica group got cancel flightlat fee waiv cant ticket book 218 rep help either,17
unit still refund word via dm pleas resolv issu cancel flightl flight useless assist trip,19
unit delay due lack crew delay there long line deic still need improv servic unit,9
unit eriord express connect huge popular could eriewr hop,17
unit think board flight au1066 earli think,14
unit gate agent hook altern flight way prevent constant issu would rock,12
unit worst nonrefund first class ticket oh select globalfc system auto select economi wupgrad,19
unit cheertymedad buy tix 3 day flight cant transfer tix flaw secur logic flaw custom servic,13
unit start claim 810 week unrealist realli suppos go long car seat childridicul,18
unit car seat lost unit reimburs new one pair shoe necess child,10
unit highbuddyyi total suck cousin work phl said unit,16
unit begin feb call unit said would send anoth voucher mail never got anyth tiredofwait,2
unit internet great thing email execut compani mayb respond time manner,0
unit that weak see ya hey virginamerica,14
unit flew back w compani sinc unit didnt earlier flight,14
unit tri book award septemb need flight aegeanairlin show even w mani award seat availab,6
unit sure drive total 3 hour get bag id like explain debacl one want talk,0
unit see told repeatedli pilot late flight kept get late flightr board defibril issu,2
unit prefer secur line anymor tsa precheck didnt pull silverairway partner flight platinum spoil,8
unit newarkliberti airport need indic differ gate termin aampc flyingainteasi,13
unit ye pleas newli marri tri updat last name preexist intern flight seem easi,13
unit unit refus reissu 400 lost voucher plane didnt take due mechan badcustomerservic,9
unit also run instruct shatter comput,3
unit ye weve agent last 50 minut one agent rude thank ladan nice,4
unit iah charlott baggag claim rep latric h customerservic non exist ignor custom inappropri touch custom,16
unit uctraveladvisor would love respond websit saw realli long form busi new seat bad,0
unit refund flight voucher anoth flight differ airlin expens today 8 hour drive inconveni,17
unit receiv call back 3 daysit infant car seat suppos go anywher child,0
unit well sit ground time wait gateagain tiredofthi,2
unit need guy book plane concern ill travel someon els move forward,9
unit measli 50 ecertif appreci loyal custom wait 3hr tarmac ua1116 unaccept,17
unit email addressusernam signon avail,18
unit rude rude,12
unit cant get board pass austrian airlin codeshar flight rebook incl 6 hour layov amp stuck outsid sec,3
unit receiv flight unit truli break guitar unitedbreaksguitar wantmymoneyback,17
unit flew telaviv paid 100 third suitcas didnt even make plane besid impolit servic,9
unit bag still colo spring disabl search unfamiliar airport look bag good outcom,18
unit shame there flex ticket transfer rule even call neurosurgeri icu isnt enough,3
unit denver said dont handl baggag made colo spring gave 800 number call help either,12
unit guy need seriou train custom servic mani better option put way guy handl ur mistak,1
unit found problem avoid like plagu told cant find supervisor,10
unit zcc82u cancel flight flight 16h advanc need connect flight reschedul link isnt help help gf wait month see,17
unit fli,1
unit addit first flight delay hour im arriv destin 8 hr late flight,2
unit travel book thru unit group dept okc ticket agent less will help connect lax,14
unit v upset disabl servic told one employe carri medic equip rude,18
unit thnx quick repli dont think assist intl grp put consider inconveni today,12
unit wont transfer flight ticket accompani 11 yr old who activ militari mom emerg brain surgeri wow,13
unit getmeontop 7 week late flightr still receiv mile mileageplu gift card 150 starbuck card hand,4
unit 1k im alway hope improv,18
unit yet complain guy check luggag throw bag around unfortun coincid hope,4
unit okc ticket agent roger mclarrensp less help intl group travel problem cant find supervisor help,14
unit mobil app need construct ground os categori expens get right,0
unit anoth fail unit ticket agent okc less help could care less problem american come,14
unit sent email custom care tell may break sincer hope help,0
unit silli im fli delta today unit club staff attend surli unhelp alway seem bother peski folk,17
unit phone number cant find call flight reserv,5
unit well cant fix miss buddi 30th bday neglig attempt make,14
unit believ help custom servic couldnt like said want number someon fix,0
unit help baggag servic desk said bc tsa screen fll bag made bag ewr 12,0
unit mobil board pass disappear phone stand line board second time week hmm,4
unit explain eager flight attend tri ask vision ccicanin guid dog,2
unit what point ask detail servicedog book flight crew doesnt read continu,14
unit tri one avail bogota everyon rude houston stuck 35 hour guy,18
unit worst2unitedflightsev ua 236 la iad 224 mechan problem took land fix delay wtfodd,2
unit what go ua 236 outbound flight last thur delay 4hr long delay worst2unitedflightsev,8
unit worst2unitedflightsev ua1429 iad la 219 mechan problem switch aircraft delay 35 hour,2
unit crash tri check,5
unit 768 logan board gong show due lax carri enforc bin full coat room bag u need better system,12
unit blackmail pay 130 extra return ticket nullifi san francisco airport terribl servic rep scam,13
unit disappoint u didnt honor 100 credit given ur mistak take busi elsewher,14
unit ua1673 still wait suppos depart 908,10
unit credit last trip never came mail,1
unit ok 7 month wait hear airlin gave quit bit 30 day request terribl servic,0
unit process ever end still wait repli sinc 2 month pathet customerservic,7
unit what go websit im flight book problem three ticket today ive boot system umpteen time,19
unit get account number websit say email unavail,5
unit receiv 1 bag last night still miss one,4
unit simonroesn youll need upgrad seat even economi plu like sit concret bench,3
unit 2nd flight also delay pilot board sit schedul,9
unit hard stay upset someon least tri show remors,13
unit way simpl apolog goe long way even hollow one obviou dont care wellb,16
unit isnt one time thing either shock pattern repeat neglect disrespect,18
unit finger cross amp intact disappoint experi actual say enjoy use,16
unit incred easi fix would rather stay comfort zone get forc mine,14
unit juli zero excus outofd system caus problem like,0
unit everyon around us sit friend famili member book ticket octob decemb bought,13
unit sure talk go nonstop flight sna sfo sfo ewr,8
unit im move americanair unit talk servic,16
unit ask legitim question systemwid vs local problem got back unrel flightd copypast better,10
unit time call need ski go airport get faith unit,0
unit see guy amaz one compani continu make mistak yet fail held account error,14
unit yeah sorri there alway problem unit intern reput problem,18
unit mayb bbbne_sd_ks_ia would care hear went whoever listen issu caus,0
unit wonder share fb insta would produc number 140 charact realli limit stori tell,10
unit your tell number call left airport neglig pilot staff,4
unit could email resent doesnt appear arriv,0
unit follow order dmcome,0
unit 25 unit coupon make broken entertain system 9hour flight serious ridicul learncustomerservic,13
unit didnt drop bag overnight amp im leav week suppos hold bag,8
unit dm detail still respons book today,19
unit abl dm confirm number,0
unit ive sent messag let know got im twitterliter also realli go stuck 18hr,2
unit unhappi respons complaint email 2nd feb ref8441639 aw custom servic,18
unit given option use unit travelbank recent flight book problem help use recoup fund thank,17
unit common keep paper work readi dont delay flights1585and meet choosechicago,16
unit yep that correct got email 1230 flight cancel flightl doesnt matter flight atl delay thx,17
unit 1k problem get fll iah sent dm make connect pleas let know,19
unit im ground montreal ua3659 miss connect ua3417 st loui helpdo privat jet,19
unit im frustrat nervou,3
unit one make difficult,4
unit im child im someon issu fli prepar ahead time reduc distress caus plane,8
unit get cancel flightl 10 hour take,17
unit alway happen guy make travel incred stress uncomfort good busi,14
unit someon sever anxieti one person help isnt next,18
unit im seek go 2 client bc u cant get need refund fill form confid work past indic,19
unit luckili made flight time disappoint lack commun,2
unit check see flight 3466 atlord got cancel flight,17
unit servic far horrid want end trip high note guess that option,7
unit book flight home 7 month ago request seat togeth fiancé got 2 middl seat unaccept,3
unit guy horribl,1
unit pay 17 wifi intern busi ticket pennypinch,14
unit ok top thing youv lost luggag could get wors unitedairlin,0
unit luggag broken youcouldntmakethi brokenwheel,19
unit mayb one day youll one quot,18
unit flight delayedno one rememb turn heat flight 559 leav ordseri,18
unit speak real person get resolv polit effici 22,5
unit hadnt file refund claim told charg dm disput bank henc would like12,11
unit bag make flight iad second day without cloth pretti inconveni pretti curiou unitedairlin,2
unit henc ive ask custom servic phone number speak real person get sort,16
unit bag leav washington yet would conveni see left day ago unitedairlin lostluggag,14
unit accord dm im owe refund pleas may provid contact number go bank file claim,0
unit 3 hour ago need work bag make hotel time need go elsewher,5
unit pl properli train agent request speak 1k custom servic amp transfer dead end even open hr,12
unit thank rememb load bag onto connect flight oh wait forgot iceland fun cloth,9
unit custom servic atroci disrupt travel plan lost luggag imposs talk human,12
unit termin mia food open 5am esp flight 6am two hour earli like recommend cant eat,9
unit ua flight 1001 im current stuck portland miss ride 3 hour delay getmartyhom,2
unit respond variou request contact number anyon know uk custom servic number unitedairlin,0
unit look get bag lusaka,0
unit could updat suitcas pleas onlin phone track told noth told id back yesterday,10
unit 1 last thing u guy shouldnt charg drink transatlant flight,10
unit lhr arriv loung fail wait 20 min shower left find hotel u know mani passeng u carri plan,9
unit complet form doubt use ua doesnt care 6 day vacat 5 sure ua wont feel respons,18
unit nope told us time go home sleep airport even though assur us would get room,12
unit back expens holiday work year pay ruin want compens amp origin case back,13
unit thank unit understand would actual like bag back done also want money,0
unit frankli wors custom servic ever problem happen deal defin compani never unit,1
unit still valid flight seem strang delay late flight inbound crew 7 hour plane alreadi,2
unit thank lack help can respons 1k desk,16
unit bad ua anoth unforese oper issu return flight,2
unit pay 25 35 luggag deliv arriv wait 3 addit day deliveri,10
unit 8 hotel 32 peopl feel like held hostag someon board pass cant leav fail,14
unit outbound 2 bag 70 lb bag return home 1 bag 50 lb logic write machin human help requir,3
lindaswc unit dont like hear poor experi pleas share detail wour custom care team,0
unit cancel flightn left us fend flt came late flight get runaround 3 hr employe blame previou 1,12
unit okay ase24766m find luggag,10
unit agent met us gate said issu wdelay ua1116 would taken onlin,7
unit ladi one phone say tel aviv tel aviv unit say newark one know noth,16
unit ye still answer mani luggag 3 day unaccept,10
unit go noth like alway,18
unit plu food taxi,18
unit offer us 8 room 32 peopl fail,2
unit 32 peopl get pretti tire action solv problem plu miss day vacat ski,2
unit bright side would keep promis made hope your good night thank,4
unit take back comment team work hard help us far solut hotel food anyth fail,15
unit 4124 arriv two hour late flight clt sit tarmac move plane gate unhappi custom,9
unit airlin absolut worst idea neveragain unitedairlin,1
unit thank might want fix line custom care team current respond inquiri within 710 busi day,0
unit frustrat frequent flyer loyal sinc continent upgrad equal pay 3 time top purchas ticket,13
unit wors cant figur pack plane screw connectn claim hotl room san fran strand pax way go,13
