documento,topico
unit thank delay flight hour board us onto flight reek vomit wasnt clean properli,4
unit land might want check flight 304 plane houston sound takeoff amp land,17
unit cant even look right ill call im mad,0
unit request onlin refund option deni say ticket use hope understand problem approach,14
unit nope still sit gate,10
unit passeng wait insid flight runway return back gate count valid journey,9
unit ye partli use delewr use return flight cancel flightl due technic glitch oper,14
unit appreci look compens anyth troubl still havent taken 1030 flight,8
unit anoth terribl experi unit discrimin delay help custom servic unit notimpress,16
unit busi decis made inconveni possibl caus lost custom good busi decis cranki,6
unit pleas provid updat ua 791 flight strand unit inform crew plane,2
unit thank remind much easier fli southwest get agent sfo 25,1
unit that still one day visa expir june 9 book flight day,10
unit miaewr 384 excel crew ewriad 3589 crew load bag wait w door open freez 20 min past departur,0
unit custom servic crap,16
unit thank ground crew surpris flight arriv beingsuckontarmacsuck,4
unit ua1023 sit tarmac ord visibl gate open reassign gate,9
unit usual issu express sfo posit note mainlin ps enjoy,7
unit sato rebook upset travel offic fix couldnt,10
unit kind unnerv watch guy deic plane text phone whole time,8
unit refresh browser right checkouterror load messag ticket price increas 358 matter sec dounotwantmybusi,13
unit jedediahbila unit vote everi year one worst airlin enjoy titl give jedediah free pass,10
unit think board back plane whatstheholdup chitocl,4
unit thanksseat made 6 year old broken tv 20 flightsyearmi last airlin,1
unit bobwesson fair enough unit everybodi best although slight delay turn cancel flightlat,3
unit still wait bag never got deliv yesterday cant reach real person help send dm ref number,10
unit worst flight experi ive ever never ever fli airlin,1
unit go thru detail flight want w record repeat real person get line,5
unit would person take hour hour wait time tell lie,18
unit hey dm work ua 307,16
unit refund team far custom care courtesi need train work ethic like sir u r lie help,0
unit split flight quadrupl price,17
unit contd told ask refund use ticket flight got cancel flightl ticket use,17
unit sever trial sever hour wait phone contact custom care get refund get cold shoulder,0
unit book paid flight get denver specif time meet fail wasnt caus weather,2
unit dont understand isnt flight paid premium get cancel flight best next avail flight,17
unit flight aw one lavatori function peopl line bump etc cant use 1st class bathroom ridicul,16
unit actual arent still park,16
unit appli one travel certif per itinerari even multipl flight,14
unit log view reserv tri view specif reserv amp take back login page,7
unit 3 time flight delay miss next flight time youv lost baggag clean cloth 337 flight thx,13
unit hell mile expir realli look forward accru enough free flight 10 year,10
unit im familiar procedur wouldnt first time unitedairlin lost one bag unhappytravel,0
unit get give inaccuratemislead info doesnt seem like great way hopethegearmakesitintact,0
unit clean region jet take hour,17
unit tri charg 750 539 flight tri make chang phone includ 200 chang fee wtf,17
unit flight 395 roll delay 1 hour 42 minut,16
unit believ custom servic last post narita tokyo sent motel rest said standbi mayb 2day,18
unit websit complet joke use safari,5
unit new seat canadaair region jet plain suck,3
unit airlin abus expens video equip overcharg privileg via robthecameraman,17
unit that repli lol hope least new plane maintain flight,0
unit somebodi say flight upgrad,3
unit tripitpro accur delay dept time 2hour late flightr hear curiou,18
unit tell airlin lost mine famili busi day age messag twitter travel fast,10
unit tri reach number last standby gave 1 meal voucher potenti 2 day standby,7
unit disappoint custom servic,16
unit board 6373 time deplan 100 minut delay transpar cant wait give gold statu aa,9
unit 44stocker wife sarah stocker also call could connect custom servic,17
unit victim scam shit custom servic time agent hung wtf teach staff,16
unit flight 1219 frustrat boil deal attend attitud ridicul,17
unit nice know 3 hour time worth 799 free directtv everyon ever hear prevent mainten,16
unit may true howev 4 week matter still unresolv get supervisor manag help,16
unit obvious one know darn thing around get resolv,7
unit notif yet staff board say accur departur time,14
unit im know seat actual narrow seat feel like mayb im extra bloat,0
unit dm sent lack custom servic get ridicul,16
unit delay go home get realli tire delay,8
unit uh book ua websit price chang,2
unit im rebook get home 4 hour late flightr plan chanc ill ever see bag unhappytravel,17
unit unit club team amp got seat late flightr still sure last min ual cancel flightlat cost yet overbook folk get,4
unit flight 5559 yyc provid free food allow back board broken lightbulb,13
unit look fare return companion flight dont understand addit 200 fee necessari,14
unit flight 5187 specif last two probabl 30 feet apart within sight,1
unit without baggag 5 day cant get updat houston airport sinc monday worst servic ever,16
unit ye three differ checker along walk plane overkil,10
unit bummer might go americanair card instead ty respons though,19
unit im sure busi go els airlin travel name kathryn sotelo,5
unit made check carri flight 1449 pbi newark plane luggag stow full u r cost time money amp aggrav,2
unit way contact flight work father pass head denver,19
unit two flight today let hope kit get treatment,19
unit pleas help regard pnr a3zz0f waitlist flight,11
unit hope solut insur cover issu,7
unit custom servic solut might miss show,16
unit deserv go bankrupt delay outbound flight info connect flight go miss,2
unit flt 3444 delay mainten that fix cant board flight crew didnt stay board area fail,14
unit anymor final ticket 5 min takeoff sure confus fullfar gsa ticket,9
unit ye still dont know ive told might flight one confirm,0
unit wind chill ithica 17 degre troubl lose cloth give tshirt ill burn warmth unit,9
unit call custom servic 2 delay flight today luggag misplac disast across board,16
unit crew notifi passeng move water fix tarmac two hour,9
unit link help put touch manag,16
unit delay cmh ord ran gate 1 min b4 connect door close one around ignor 1st agent 2nd super rude thanksunit,15
unit upgrd guess kit kat look tasti go near sandwich,13
unit wors head laguardia delay tray tabl size mous pad overhead size pocket,8
unit 1558 iah ewr broken entertain system wifi despit info app,19
unit custom servic terribl,16
unit pleas send help asap kathrynsotelo flight 5957 chicago seat 9c airlin,17
unit defin appreci doubt worst major airlin usa act much feedback,19
unit yea refund airlin ruin trip,18
unit that wonder unfortun doesnt help 4 hr flight major us citi disappoint,17
unit thank delay flight hour miss connect flight terribl custom servic neveragain vacat,2
unit got rebook aa one question though automat refund check baggag fee flight cancel flightl,17
unit good 1k team noth short amaz everyth,4
unit new flight window kind tick pick aisl seat hate window seat annoy epicfail,3
unit nope rebook houston could get amarillo 11pm stuck sfo four hour,0
unit money suck airlin terribl terribl custom servic,16
unit awar airbu fleet suck id rather fli c130 full rubber dog shit,1
unit fyi staff tell custom tri carrier,12
unit couldnt possibl mess trip anymor thank terribl airlin disappoint,6
unit wifi ua688 sf chicago 2015 that ps tech intro video joke epicfail,17
unit thank repli box mine im miss one ad bag,0
unit wifi flight ua688 sf ord realli wow,19
unit worst,1
unit haha clean plane held overnight hangar sound love also dont lie screensand say weather,4
unit charg delay unit 1612 still wait,14
unit made feel guilti economi plu didnt pay extra leg room,12
unit flight cancel flightl new flight 5012 hope,17
unit 4781 cancel flightl 5102newflight upset one cancel flight could rent car would honest,2
unit stuck ord unit cant find airplan lol upset termin right,3
unit wth honest custom better last chang drive home plane left,17
unit 2nd time row ive charg 100 plane ticket unit shouldnt check cc everytim,9
unit flight 5001 realli go leav newark today tell us rent car want end strand,12
unit thank repli saw particularli help hungri vegetarian fli specif flight shrug,17
unit funni board pass said prioriti clearli prioriti airlin,4
unit im sure offer noth inconveni put twice month tweet dont cut,3
unit youll cancel flight flight like,17
unit screw twice one month learn lesson,4
unit what point offer free check bag lose,18
unit flight vega houston cancel flight morn due oper mean thank god woke earli today,17
unit educ staff need also turn away first class cabin passeng mileag plu,3
unit item mine mysteri end check bag ewr yow flight miss black box,17
unit guessflight go cancel flightl 16 empti seat confirm import frustrat,3
unit instead make seat smallerthinn u jam peopl flightu concentr maint amp happi custom,8
unit need assist pull agent head ass,19
unit gate definit full park wheel chock custom servic call unmet arriv,13
unit abigailedg anoth glitch,2
unit realli hard time believ 4 plane termin delay mechan issu whatgiv dullessuck,3
unit flight 4465 almost half hour tarmac wait paper miss connect iah,9
unit worst airlin ever thank slew rude agent staff make delay flight even wors,1
unit chanc hell id rather walk worst airlin ever,1
unit worst major us airlin proof theyr board plane outsid galley door open 0 degre weather wtf,4
unit late flight damag done easili worst airlin experi life miss two connect flight amp day work ua49,2
unit dont know awar premier access line close termin feel love,7
unit disappoint learn charg 200 use 20k mile upgrad ps jfk flight look altern,0
unit faanew unaccept practic leav cancel flight flight passeng sleep cement pillow ua1724,17
unit u get crew member wait told 40 minut ago land still gate,9
unit flight 6212massiv fail delay transport crew member caus mani miss connect unreal,9
unit worst custom experi houston intl airport ground support even staralli member nightmar,14
unit help delay flight im go miss connect,2
unit im count pleas dont let delay needtocatchmynextflight alreadyrebookedonc,18
unit imposs actual get passeng luggag final destin,9
unit flightdelay earli craft arriv pilot stuck traffic fail nocustomerservic nocompens,10
unit oh unit much despis thee,9
unit airlin biggest joke oper world,10
unit go baggag claim newarktiredandwanttogohom,10
unit usual loung staff fantast except today mco almost deni entri loung even though travel unitedfirst,11
unit 25 hour delay misplac bag poor commun wors unsympathet confront gate agent cool,2
unit dont respond email facebook msg im still wate ticket im get realli angri disappoint,8
unit send jeff smisek trip jetblu sw make sure take note would never choos fli unit,9
unit disappoint servic level staff commun bummer,4
thank unit great news u wont refund ticket due bad exchang rate knew u would come sens gg8929 unitedapp,9
unit go rectifi pleas direct complaint depart stickingtodelta,0
unit top flight attend talk loudli throug flight even light dim result sleep,18
unit seem like one unit help lot finger point zero peopl step least gate oreo,0
unit access dial make faster,8
unit 1hr delay start huge queue secur repres meet us rude staff baggag reclaim ineffici,13
unit worst flight attend like angri drunk aunt everyth argument,2
unit black white eu law 600 cancel flightl flight want money,17
unit accordingli u dont respond,0
unit extra care airlin unitedairlin dont care trust customerservic non exist dont 1,16
unit anoth unfortun case bad luck usual mainten issu swap plane ont get late flight,9
unit shame great custom servic wasnt continu sfo slightli absurd,12
unit onlyinamerica 18 day word unitedairlin customerservic bad pr guy,10
unit still await repli ur custom servic 18 day respons lousi unitedairlin,0
unit happen airlin theyv given flight voucher transpar problem,2
unit thank im book spent extra 7 hr ten w explan fli middl seat char instead memphi,8
unit agent rick clifton seahou told father die need get handbag cabin noth shame,3
watch crew escort back 1st class prebook realli unit jenniferwalshpr dissatisfact und,0
plenti empti seat coach unit dissatisfact understood crew member travel duti prebook f,18
unit good didnt die anyth say get pay,12
unit staff laguardia lago nigeria unprofession uncar help ou,2
unit u kept passeng wait night 4 plane put servic leav everyon strand night inexcus,4
unit flt 359 lax ewr pilot brag get ewr earli wait 20 min jetway driver thank unit,9
unit happi found phone easili worst system ever heard,0
realli 9hour unit jenniferwalshpr dont like delay avoid well way asap,15
unit robbogart wait hour airport told one fib cant ual honest custom,10
unit well yet check bag alreadi vanish havent left airport yet,8
unit rapid trip plane ticket idaho california doesnt problem would wonder,2
unit agent help point there problem amp dont want mess somebodi els plan u flow tech team pl,3
unit delay 3 hour one hour flight frustrat im also unabl get decent meal hournev,2
unit think statu noth think bug search system,3
unit would appreci answer werent alert flight cancel flight plane land showsomerespect,17
unit wtf delay delay 15 hour yvr san unaccept flight crew avail blame never unit,9
unit think left phone flight help,17
unit hey left comput bag wcomput insid unit file onlin report respons,10
unit empti upon takeoff cant someon sit,9
unit case id 8473573 request 25 219 710 day ill get respons bs,0
unit thank form submit im bet someon would honest enough turn though,2
unit 20288 differ book flight want screen shot,17
unit rebook 24 hour origin flight say handl situat bad would understat,10
unit would like supervisor talk wait flight attend one walk amp left,2
unit understand situat wait open 1030pm,10
unit curiou go final learn customerservic,9
unit nice 2 see u sens humor 3hourdelay want 2 b home ill settl beer safe air cours,19
unit servic desk gate 21 help us find flight get us dest time flight got cancel flightl,17
unit 12 thank answer question want make reserv phone perth hold 24hr famili,5
unit wasnt delay much straight cancel flightlat weather wasnt issu either,17
unit thank ruin wed anniversari flight ua4904 ewr rdu delay 3 hour reach home nxt day,13
unit cancel flightl flight unknown reason havent realli given anyth make overnight layov toler,8
unit differ respons posit someth learn delta,0
unit ye flight rebook im lose trust want get anywher time,17
unit solut,7
unit im evri 1st flight take w delay amp evri 2nd time miss evri time lastflightofthenight breakup,3
unit submit complaint line never heard back dont id find,0
unit cool custom told didnt care either expect,16
unit freak worthless hate airlin,1
unit us3645 leav ord time week shame,9
unit miss daughter suppos dpt ord 559pm dpted 830pm check week averag ua3645 shame 7 day averag 754pm,3
unit fantast night wait 3 hour delay airplan alert us flight cancel flight land whatstatu,17
unit delta flight lax compens rental car,12
unit miss set hotel flight delay sfo 6 hour miss wed festiv friend,2
unit board custom onto plane pilot thing expedit time line book new flight come,4
unit stuck tarmac last hour beer,9
unit recent servic bad nc trip awe disappoint never,7
unit freez gate bridgewaitingforbagsunitedewr,16
unit land 940pm stand wait bag load plane sidewhi isnt crew heretiredcustom,9
unit dmb41show need plane get buffalo leav tonight progress,9
unit rebook howev would nice wait extra 90 min airport make right,7
unit enough alreadi poor servic old plane ridicul rout 1k time find new airlin statu match,18
unit wait hour final board airplan find call mainten plane cold,9
unit broke suitcas amp refus give repair estim,9
unit schedul flight crew compet person work airlin,2
unit help 689 chicago get gate freez runway seem like crappi thing 9pm,3
unit thank kp what go w4840 tonight bad updat onlin phone cant u give custom good info wast time,0
unit 4840 knew flight delay mht alb ewr get crew arriv late flightr departur updat site,15
unit 4840 wtf cant updat time time manner youv known fight delay ur servic aw cnn,3
unit wait plane long miss connect flight left earli that last flight tonight help,9
unit ord gate c25 flt 619 rememb custom valuabl hard nice someon lug guitar amp carryon,13
unit worst servic ever deni access flight move flight 6 time hard schedul gate delta next time,16
unit im denver bag san jose see someth wrong,11
unit know bad your pray connect flight delay hour delay first flight justgetmehom,9
unit play hide seek gate cant find minut,11
unit flight ord delay air forc one last flight sbn 820 5 min land,9
unit 55hr late flightr still cant figur random text updat embarrass ua3728,2
unit stop pick us cle,4
unit book flight sept get best price april usa check 67 cheaper con unhappi custom ripoff,6
unit big properli manag flight time thing time least prepar gate land,16
unit id rather truth flight forc sit day tri get home,12
unit anoth delay day delay outbound delay inbound wait ewr gate readi readi,9
unit cancel flight mileag plu award reserv g6455c day yet see mile back despit agent confirm,17
unit 3 gate chang 30 minut flight roanok flight sou fall ohar pain,10
unit nut said flight ground still albani wont plane someon compens,4
unit doument via link howev four month respons suggest shall expect one,7
unit yall zero concept custom servic ohand connect delay,3
unit curiou youd board flight without pilot seem crucial flight process,9
unit chang crazi youragentshavenoclu,11
unit never get flight time 4 hour delay earlier anoth hour delay connect flight make 10 straight delay,2
unit bc delay oversold 14 passeng mess go compens,9
unit blame weather lol 78 wind cloud sky delay way 4x ru kid charg 15lb w8 delay,0
unit worseoh cant delay reason way lonflight cancel flight reason less 2 day return,2
unit flight 48413 gate chang top realli hope compens pointsmileag account,17
unit contact other flight cant get websit work none info valid,16
unit hour stuck still plane total failur partner ensur best custom experi,9
unit silenc tell,7
unit thank 2hr delay ground crew land least didnt break,2
unit illiter magic code make custom servic site work,14
unit worst airlin ever staff nasti wifi bag delay due weather belt broken sell ual stock,1
unit im confus dulles_airport agent direct us go websit delay noth work,8
unit 50 minut waitstil gate broken jetway might miss connect,9
unit robcnyc see inform board process kp get group 1amp2 reason 35,10
unit lost wallet flight 1007 yesterday houston bogota fill onlin form respons yet,17
unit one hour departur time still updat,2
unit follow see one experienc notic substanti downgrad servic post merger,7
unit 40 minut wait gate broken jetway differ gate mayb,9
unit never got flight austin houston time connect ever ever,2
unit sit tarmac half hour land jetway broken 2daysofunitedfailur 1thingafteranoth,9
unit look twitter histori usual servic non exist,16
unit make sure make cancel flight flight baggag upgrad fee seem like labyrinth might abl swindl,10
unit consid time arriv destin half hour late flightr schedul,2
unit thank tri take money without notic industri cancel flight servic refund issu cont,17
unit direct phone number statu match desk realli regret flight book problem unit,16
unit yet disappoint sit iad ua3728 35hr cant seem know plane hasnt left albani fail,9
unit still sit wait plane4 hour wast,9
unit line get longer move slower ladi work counter great need help customerservicefail,16
unit updat flight 5979 would great,2
unit wast time baggag claim thank dfw ground crew check bag without actual check space frustrat,4
unit problem flight ny today,2
unit flight heavi fli back palm spring air 30 min,12
unit board process suck learn southwestair,14
unit ouch delay due mechan issu qro wait yall seem fall apart alwaysdelay unitedfail,9
unit finger cross capabl get baggag point agtb unit airlin,19
unit happen afternoon huge amt incom plane sfo delay 12 hour frustrat,16
unit way impati partit untruth proper system place,0
unit mayb 1 person work custom servic desk houston airport line 3 row deep 1 person work,16
unit survey long fli lot segment ill fill everi trip take minut,1
unit think hire baggag attend ewr wait bag 1 hr unit overchargedampunderserv,9
unit tell cancel flight flight,17
unit would hard wors last time im sure youll give shot,0
unit servic staff less friendli,3
unit transfer bag,4
unit comedian promis make fun stage tonight,7
unit tri got whole 2000 charact even done,11
unit us reboard without captain well sit anoth 20 min,9
unit flight 1712 houston delay duecto engin troubl willl hold connect argentina houston sinc im late flight,13
unit delay flight slc 25 hour give snowforc,2
unit airlin joke 1 person work special servic ewr line 15 ppl deep grow,16
unit concern close club paid alot 10 last flight 1115p construct go inconveni,17
unit care less person although walk away complain man 10p lax club,4
unit smile,17
unit worst airlin world8 delay gate agent lose mind 15 lb charg 100 top 25 alreadi paid,9
unit bwood wed prefer everyon hear complaint amount airlin,10
unit bother survey,0
unit worst airlin ever 70 leg travel offici done time vocab im take premier statu,1
unit donna juan still best unit club_ bad ual get,3
unit want contact someon question amp put hold 5 minut order hung sent pet line,0
unit keep delay flight horribl custom servic,16
unit realli think downgrad boozefood select club good way go look aircanada,12
unit guy atroci far better servic silver delta platinum ill switch back delta,1
unit deni call got hung speak manag second call,0
unit club den east west disgust,12
unit instal work kick hour wouldnt let back four wast hour,16
unit that tri enter email 2nd devic made email typo way fix amp option log outin,7
unit 46hr told guess theyv appar bag 20hr call,0
unit still wait 4 bag web still cant tell locat come up fedex tell u given minut,10
unit serious wait 2 hour plane 1020 flight leav 3pm leav plane great great,2
unit like hear havent repli tweet andor email yet,0
unit rude grouchi agent dull checkin got 19 hour trip lousi start need nap someth,0
unit 1k use special 80 peopl group one board global 1k togeth,14
unit that didnt read entir tweet wife 12pm flight delay 630 that 3 6 hour flight delay 2 week,8
unit alway help commun custom,16
unit im sure,0
unit help custom couldnt meet subsequ lost,17
unit problem laptop phone,2
unit question given food voucher cant use planehow come,10
unit wifi ewr loung remind old day dial,8
unit need pay car could flight 4 help desk say alreadi left shame,17
unit long 140 charact,10
unit bossf waiver busi cancel flight due weather beforeaft flexibilitycompass extrem circumst,7
unit tri alreadi amp tri forget wifi network connect still forc log incorrect email suggest,11
unit see tweet littl 7 min ago ignor cs request cantlogoutofunitedwifi,15
unit mean 2426,9
unit 46hr yet,8
unit anyon awak pay wifi iphon need use laptop logout option wifi flight time wast,17
unit great job answer public messag direct privat messag much,14
unit work custom support extrem sadden unit wont waiv chang fee flight cancel flight due east coast storm,17
unit how refund come along,18
unit anoth fcking delay past 32 hour,2
unit 777 sfo hnl zero entertain systemsyouareonyourown,16
unit log wifi flight dont see option made typo log help,14
unit flight ua5631 sfo burbank delay twice still plane sight get togeth,8
unit say truth dont even email 2015,14
unit mr she way thought id detail extravaganza dobett pleas,18
unit follow baggag rule websit still charg 150 go one way,14
unit sent dm hour ago,7
unit need track lost luggag ship need ph human autom 8003352247,12
unit weigh 455 check bag,18
unit nonrefund henc wrote 200 doesnt make sens 150 credit nothank,14
unit websit day yesterday tri 3x put info inampdidnt go thru today flight bought went,13
unit realiz wife wait delay flight moment im sure understand tweet,9
unit im minor freak bc might make connect flight hawaii ye im frustrat,19
unit deni sure charg 150 one way 25 way hime,0
unit even chang could made onlin instruct call agent mayb syastem allow agent 2 link passeng,7
unit case id 8544484,18
unit airbu a320 seat aw dont reclin,3
unit dm follow im plu theyr option that fli epicfail,3
unit sit plane hour schedul takeoff without cloud sky keepusguess isthisyourfirsttri,15
unit airplan otherwis would call polic flight take 12h30am,17
unit perfectomobil huh sent 16 crash report feb alon 8 one day app consist crash,5
unit abus threaten forc travel lower cabin last seat yesterday flight houston sao paulo,3
unit contact yesterday told there noth suggest email compens cust servic,7
unit unfortun doesnt help autom comput,0
unit airlin delay flight way chicago leav chicago next time delta,2
unit inquir noth itpretend theyr interest respond dm respons back,19
unit must stop relationship youv becom greedi heartless long term relationship,13
unit custom servic lack owe gopro camera also appreci interrupt everi time speak thank,3
unit get refund would like book better airlin,0
unit call discuss told unit phone contact passeng absurd,12
unit messag request call baggag team still newark pleas help let know next step,0
unit guess that busiest rout base trafficfuel cost region jet decis still great 4 travel,2
unit flight delay 40 minut ord plane didnt food fix futur dumb delay,9
unit need chat actual human asap,19
unit got email say chang mileageplu account confirm didnt make chang help,14
unit 310 disappoint servic miss connect hour delay cramp seat least app good,9
unit joke hang custom,16
unit charg one way baggagefind other leav pittsburgh equip werent charg hung,18
unit publicli ask detail flt sent dm like ask yet 2 day hear unitedfail,0
unit realli hope get help 5th attempt get resolut lost count transfer help pleas mileageplu,17
