documento,topico
usairway guy worst airlin ive ever dealt notif keep custom updat terribl servic,1
usairway hey guy thank answer thank keep hold hour custom servic 12 pm pst,16
usairway worst airlin ever travel,1
usairway lazi inconsider unprofession airlin ever travel,1
usairway pride servic concern wife everyon els flight dont care,16
usairway u horribl peopl say sleep,15
usairway who charg compani wife miss connect ca sent luggag anoth flight,12
usairway call hung,0
usairway got messag site call flight gave hold 3 hour,5
usairway usairway lost passeng today uphold promis excel custom servic,15
usairway yet staff philadelphia fail send luggag home alwayshappensther angrytravel,3
usairway ok 4th tri todaygiv 1245am 138 minut hold time terribl,18
number email that purpos send tweet usairway,0
usairway still say cant check flight inform incorrect everyth enter correctli,13
usairway say estim leav hour ago hasnt left yet thank use inform theworstairlin,8
usairway custom servic horrend way employe speak custom lack care problem flight,16
usairway mom sit 3 hour wait flight ultim cancel flight give tuesday morn flightno compens ugh,17
usairway anyon airlin know job,5
usairway worst airlin time,1
usairway deni standbi bc check bag cvg 5163 phl 6so take delay 3751 4 hr late flightrexcept u lost bag cvg,13
usairway remind today fli southwestair,1
usairway ive tri get book reserv system let day 3 ridicul,5
usairway worst,1
usairway make folk run gate c29 a18 b11 explan zero cart transfer elderli handicap phl,14
usairway wait airplan total 3 hour take 2 flight todaythi usual doesnt happen,17
usairway given option new flight cant get plane phlmia 20year eventprof worst travel experi ever,10
usairway doesnt let u stand flight due check bag caus u get 5 hour late flightr get phl amp bag didnt make,2
usairway absolut worst experi life phl 6 hr 1 fail departur 3 gate zero commun help,16
usairway americanair soon call custom servic speak repres disconnect,16
usairway americanair tri call custom servic sinc 9pm hour disconnect spoke one,0
usairway give us inform attitud,15
usairway attend gate enjoy watch flight destin take horribl attend give us,2
usairway strand miami without updat departur board cancel flightl flight,15
usairway absolut terribl manag delay delay undelay delay 6 time 10 offic hour,6
usairway americanair rude unreli horribl compani equal rude unreli horribl employe stay tune,1
usairway phl take hour offload bag especi take 30 min get jetway get plane land,9
usairway flight 703 philli gt mia bwahahaha delay 5 hr air 30 min turn back around usairwaysfail,9
usairway im tire pay luggag amp less stellar custom servic americanair notafanofyourmerg,12
usairway heard debacl dca happen new orlean flight wewanttoknow,6
usairway think littl weak sauc zero inflight entertain 4 hour flight salt lake philadelphia,16
usairway flew good weather land anoth technic issu gate improv servic lose custom,9
usairway strand custom reflight book problem answer phone way treat platinum member,15
usairway made reserv onlin didnt receiv confirm email bank said transact went u help,12
usairway worst fli experi life flight schedul departur 544pm phl 5 hr late flightr guess,2
usairway updat flightit three hour delay thank,6
usairway americanair partner w differ hotel phl clarion prove difficult amp custom friendli,12
usairway truli dissapoint flight delay go miss connect expect rebook flight,2
usairway kind screw day least outbound save strand renhotel marriottreward,17
usairway nightmar tri get costa rica phl today stuck miami one answer 800 number,12
usairway peterpiatetski ummmm think us air computersweredown hour flight 3 hour late flight,12
usairway comedi error continu cant get gate broken truck way fail,12
usairway instruct say call im said,0
usairway fact get notifi hinder abil look altern flight snap,12
usairway your realli fudgin delay justwantmyb,8
usairway discov bill us 300 reschedul flight cost second day lost work,4
usairway today usair cancel flightl reschedul flight amp notifi us except possibl home phonenot help sinc co,17
usairway cant get phone,5
usairway thank ruin last night vacat worri flight yall dont record,6
usairway 2 hr tri reach real human final hold 136 hr synch reserv,5
usairway usair idiot took plane amp gave someon els fudger flight 799 philli orlando,16
usairway miss flight rude csr flight till tuesday answer twitter help rt pattonoswalt your hope,17
usairway delay 25 hour longbeachairport tri get phxskyharbor give us updat pleas,2
usairway phlairport alway nice custom servic manag threaten custom stand understaf line last hour,4
usairway pass 3 hour mark onholdwith call gave 25 morn,5
usairway lost amp found wife lost phone philli amp follow web instruct call 800 answer,7
usairway dinner reserv minut ive tri get sinc breakfast onholdwith,5
usairway clt pleas send one cust svc rep cust svc counter assist line door,4
usairway help ive hold almost two hour tri 2 get home,5
usairway pleas call late flightr accept neither hold 5 hr onholdwith,5
usairway sit gate 25 min us 728 give,9
usairway wouldnt need wait hold 6 hour websit work correctli pleas respond,5
usairway get answer question hold hour 6x get messag said arent take call,0
usairway hell overbook plane knew peopl actual seat assign inept uncar piss poorplan,4
usairway worst servic reagan int rare post compani servic annoy weather relat flightdincompet,7
usairway hold 25 hour get 2 hour hold morn answer help,5
usairway farmi phone wait time longer abcnetwork oscar coverag whatcustomerservic,19
usairway chairman prefer 518758 lifetim mile us air reward firstclass upgrad americanair usual,16
usairway 45 minut delay take 30 minut wait check bag realli,9
usairway ive hold 90 minut terribl custom servic mess reserv,16
usairway wont help get luggag back im teen tri chang world dc flight5182 usairway,12
usairway southern hospit luggag deliveri servic sav aw great deliv empti promis luggag 8hrsampwait,13
usairway 1st flight us air plane mechan issu wait 90 minut help custom servic help manag,16
usairway flight miss due mech issu food voucher transport differ airport rental reimburs,9
usairway phlairport dont control stupid room plane come better mess us,15
usairway interest forward compliment never complaint world worst airlin goingforgreatnessfail,3
usairway flight 4500 403 delay crew avail give im get tpa 25 hr past schedul arriv,9
usairway airport dca airlin mess flight also cover hotel cost dca 5hr,15
usairway line 90 min mechan issu caus miss flight 1 rep 20 upset peopl,9
usairway someon pleas answer call waaaaaait,0
usairway hold luggag hostag flight 5182,5
ive tri set phone interview day hope posit wont fill link doesnt work usairway,5
usairway call find rebook tomorrow ask number email day info,0
usairway us airway dont care custom worst experi today us airway wife toddler,3
usairway rude staff said dont care market place food your go vacat work nice huh,16
usairway got stand list earlier flight dca statu check bag suppos 4047 thank,4
usairway flight keep get delay late flightr late flightr,2
usairway contact got autom respons wont give code,0
usairway realli letter say discuss serv drunk drink doesnt help current situat,2
usairway americanair mean americanair might care sister assault one flight,16
usairway top dozen ppl miss connect one person custom servic abysm,16
usairway americanair possibl someon drunk bring wheelchair keep serv,12
usairway servic phl abysm hour runway wait gate inform anywher miss connect abysm,9
usairway americanair worst custom servic ever let peopl assault flight noth,1
usairway americanair provid pilot flight new featur merger effic,17
usairway guess ok peopl sexual assault flight nice custom servic,13
usairway pleas help need plane wait go elmira tarmac hr baggag took 45 still thru custom,10
usairway americanair usair 703 return phl due issu fire detector happen next,9
usairway ur specialist said would talk stewardess serv drunk drink realli help,2
usairway wrong boston plain leav tonight son need get back state colleg pa,9
usairway two hour hold talk agentthen disconnect tri two day wtf hire csr u make,10
usairway dont pilot clt ord least anoth hour earth would board plane make sens,9
usairway flight 2120 pleas get us flight plan alreadi issu 21st centuri,2
usairway fail inbound flight arriv schedul outbound departur still time,15
usairway thank three cancel flightl flight make us go raleigh charlot lexington philli istead raleigh philli,5
usairway rant cont top reschedul flight tpa 1010 alreadi delay bad,12
usairway advis what happen departur delay clt,15
usairway americanair delay mechan issu weekend flight ridicul tweet long delay,9
usairway happen sit philli hour pl take care flight 759 chicago least least us know solat flight,2
usairway phlairport pm w answer flt 4278 still time ground hr w gate need help pl,9
usairway phlairport plane schedul come time actual happen bozo dont room us incompet,9
usairway phlairport reason avoid phlairport usairway like plagu glad see merger work well dumb,15
usairway americanair word accommod passeng us 746 arriv charlott lot tire passeng,12
usairway hire smarter peopl system keep crash instead mook man airport godelta,13
usairway flight 614 keep tell min take hour first time best lie brokenpromis,18
usairway wrong guy inabl get plane philli time pilot gave us answer bs,5
usairway guy worst fli philadelphia two jetway avail time planepisspoor,1
usairway where luggag wait hour flight 2118,5
usairway suck philadelphia let us plane phl,9
usairway americanair piss thousand east coast custom delay longer flight fail,6
usairway 2 hour count kind travel voucher get,5
usairway weve wait gate 2 hr wait stow luggag,10
usairway that 1h 10m wait get bag 1h40m flight delay plu 2hr delay way never fli,2
usairway stuck florida flight servic suck nofood nodrink nohelp,3
usairway cant gate agent flight 759 provid updat serious ridicul long peopl wait,2
usairway ivr hung high call volum need help call,0
usairway tweet apolog enough delay fiasco none insult gate agent wors except mark n bad clt,16
usairway pilot flight 729 didnt show departur amp there broken comput next time fli unit alwaysl flight,13
usairway flt 4827 elm still gate still make thru custom,10
usairway americanair accord costum support websit hold money hostag cant anyth,5
usairway way tell gate go stuck tarmack intl flt flt 878 go elm gate f6,12
usairway suck delay mom flight 2x cancel flightl delay flight todayal mech issuessh 2 sleep airport,12
usairway rout system goe ground long haul flight think failov plan,19
usairway truthh4 didnt give wifi password smh,12
usairway americanair sit gate flight 719 hour due comput backup plan place,17
usairway cancel flightl need locat baggag,17
usairway need help locat bag arriv denver last night midnight charlott 8am flight haydensteamboat,4
usairway go comput flight ground airlin suck much unansweredquest,11
usairway americanair 2hr late flightr final take,2
usairway hold passeng hostag comput crash custom friendli let us plane get us move,3
usairway hold hour,5
usairway pilot tell americanair us airway flight across countri stop due comput system failur,12
usairway flt 4609 land half hour ago singl bag yet baggag claim hate much right,16
usairway americanair one pleas answer phone,5
usairway word delay reason lgb twitter aflam flight track comput crash rumor true,3
usairway stuck gate charlott nc wait releas paper fix broken comput system,10
usairway sit gate flight 719 hour due sabr backup plan place sabr fix,9
usairway cancel flightl 837 dont want put us hotel night guess,15
usairway realli 8 hr delay virgin island even food voucher,2
usairway worst ever dca customerservic,1
usairway 2nd februari row strand us tri return cancun contact info way rebook badcustomerservic,7
usairway printer problem caus us sit runway 45 min get togeth,9
usairway noth like back back delay flight let hope one isnt 12 hour like last time,0
usairway pleas help find luggag sinc your one lost custom servic suck,0
usairway happen reagan airport dca long line four peopl work checkin unhappi dca,16
usairway aurorabiz check bag phlairport bag handler broke suitcas stole camera bag return trash bag,18
usairway hope crappi servic improv u becom americanairlin angryairtravel winterstorm,16
usairway 2 peopl work counter dca massiv line poorli play winterstorm,16
usairway usairwayscent lost bag land hartford 639p tonight deliv danburi ct tonight,12
usairway contact aw experi 21515 usairway flight 713 bufclt,2
usairway americanair nvm bad hour half thank,6
usairway crappi flight due delay rude staff member im happi report pay 25 check luggag ruin,9
usairway alway let,18
usairway dont understand cant get miss mile flight dividend mile account help,19
usairway cant seem find pilot 6pm flight never seen anyth like drunkpilot,3
usairway realli meal voucher 7 hour flight delay virgin island,2
usairway autom messag say line busi join queue stuckintheloop,4
usairway hi suggest contact u via phone sent mail origin ticket amp result,7
usairway stuck ramp dca us air comput system crashedeverywher,15
usairway flight2031 flight hell,17
usairway gave 2 hour hold still need receipt last time promis never arriv help,5
usairway americanair prepar claim bag lost mani valuabl carri hand us2146 aa2924,4
usairway told deserv delay book last flight hear inconvi miss flight,2
usairway flight 2031 worst experi weve ever flight regret open air mile card hotterandlongerthanhel,19
usairway hello never receiv confirm code flight though confirmedso say autom repli idea,0
usairway 5 hour phone wait call back find luggag shameony,0
usairway what go phlairport ive sit gate 45minut,15
usairway 799 am phl today 3 4 flight attend downright rude hostil made 8 hour flight even wors,12
usairway hell put us hotel youv strand us messag say mechan issu weather usairway,15
usairway what deal flight comput network,17
usairway anyon actual work dividend mile depart,16
usairway flight philli system wide tech issu cbsphilli,16
usairway huge system problem dcamanu check flight board sit gate due system issu frustrat chairman member,13
usairway epic fail clt ystrdi wcancel flightl flight staff commun amp refund unus portion tix keep classi guy,2
usairway tryng rsrv flight phone past 4 day keep get autom messag call back,0
usairway americanair got int flight 799 intent rude staff made horribl 8hr flight unsuit plane,12
usairway plane bo clt 60 min still gate crew say systemwid comput prevent paperwork info give,15
usairway hold 475 today connect passeng come delay flight,2
usairway guy pleas give updat sit tarmac flight 601 yet websit still say time,10
usairway flight cancel flightl buf today wait line 2 hr amp cu servic rude flight tue need get roc,17
usairway serious keep tri seven hour corpor polici usairwaysfail,13
usairway name rett cavan gofundm page go take last breath tonight airlin care money,18
usairway would let us switch differ set flight could spend time famili pass away,3
usairway 8 month old suffer rare form cancer custom servic agent compass disgust,16
usairway best part hear attend give voucher person next hotel bgr guy say dont,15
usairway horribl cust servic exp dia today wife wait 3 hr plane bf flight 695 cancel flightl still wait bag,17
usairway realli good defer respons,12
usairway thank much ask us pay 700 switch differ flight could spend time die nephew,2
usairway americanair gma could wors airlin experi rude unhelp got yell jetblu need help,12
usairway pleas help bag way get custom servic sinc 8am morn help,0
usairway real staff behav offens flight 699 pleas look messag want particular,16
usairway americanair lax connect term 6 term 4 55min layov due delay us755aa2595 realist 2595 held,18
usairway left item plane bosphl friday ive call phl us airway amp left 6 msg return call point,7
usairway great way kick someon cancel flight noon flight rebook one two hour south tomorrow,17
usairway thank make check bag space empti flight attend dirti look,4
usairway appar comput crash bwi updat flight move,17
usairway made bahama work luggag didnt know travel happen anyway get helpinfo,16
usairway 24 hr late flightr still home hotel rental car etc 5 yr old happen custom servic first prioriti,16
usairway cancel flight flight ny 3 time make decid sampg theyll cancel flight return flight thank,2
usairway hold gt70 min 3rd attempt get receipt show chang fee upcom flight pleas help,17
usairway everyon flight 669 lax rdu enjoy wait hour amp half baggag claim bag,10
usairway cstsvc phl honor ur system realiti rcd chang hpn extra hour phl 75 get cle,6
usairway usairway raleigh nc baggag carousel staff aggress toward peopl wait 1 12 hr bag flight 699,10
usairway hold 2 hour book use take flight voucher onlin,5
usairway get baggag usaireay 699 la rdu,0
usairway worst custom servic flight alway delay,16
usairway go make wait phone long time least turn ad eat away soul,10
usairway us airlin 699 la rdu hold onto baggag hour alreadi everyon still wait,10
usairway weve learn never fli u youv lost 16 custom group hundr compani,0
usairway spoke rep nh pa poor commun bag still sit philli train staff,4
usairway thank worst custom servic face earth love 5 hr hold along w 2 cancel flightl flight,16
usairway tri reach guy im run time patienc want flight honor want confirm,16
usairway six hour even gate agent got fed left us line front empti desk stay classi us air,16
usairway lose pilot,9
usairway ad phone system wait rep annoy thing ever especi wait 10 min,15
usairway americanair miss connect due delay la suppos,2
usairway 695 might cancel flight mechan issu 6 hour late flightr 100 peopl still wait zero inform pleas send help,2
usairway 6 hour agent keep wait,5
usairway hard unload bag order arriv 45 min count flight 699,13
usairway polici tell custom cant help im sorri unaccept,3
usairway thank correctli interpret last tweet non sarcast delay flight yyz termin 3 danc parti,19
usairway cant help dont put peopl hotel miss flight polici,2
usairway friend kphl told rep woulda gone home tri tomorrow 12,5
usairway wast day vacat problem one two plane waitinginphilli flight838,2
usairway unaccept way agent gate treat pay custom,15
usairway like usdelayway anoth long paperwork relat flightd delay friday charlott today philli letsgoalreadi,10
usairway custom servic clt terribl flight delay jfk 2 hour get clt horrid custom servic,16
usairway flight 2022 phil updat suppos leav 15 minut ago sit airport wonderingirrit,2
usairway flight 4454 aircraft gate crew 2 hour late flight destin come,2
usairway pleas someon contact regard miss bag 3 day onlin track show noth,19
usairway 3818 delay blue sky whyisusairalwaysdelay,15
usairway ill never fli due emot amp financi stress caus one staff member error,1
usairway bag,4
usairway thank incur us approxim 2000 dollar fee due staff member screw neveragain,1
usairway barclaycardu 1 hr wait far custom servic ye bad weather air traffic control answer phone,15
usairway thank bad make two day train trip look appeal,4
usairway got kid info 4565 dca bgr phone line tell call back late flightr,16
usairway pretti ridicul phx sky harbor 4 employe work check sunday afternoon 30 min amp count,15
usairway realli hope dont get charg flight couldnt handl influx call bummer,0
usairway hold 3 hour pleas help,5
usairway promis help nvr fli wu even 2 pay 2 fli w sum1 els badcustomerservic,12
usairway yesterday delay six hour wlil explan paid lot 2 fli wu amp u treat ur custom,12
usairway noth issu fli wu what wthat travel vacat aw,1
usairway custom servic fail today experi ensur best never util,0
usairway ive hold 40 min cancel flight reserv afternoon anoth way web tell call,5
usairway suggest failur make huge donat the_uso charlott nc provid great custom servic today unlik,12
usairway concern gate attend c26 afternoon nocommun nocrew,16
usairway 2nd plane forc get due mech wait 3rd need hous meal stt need help b4 arriv stt pleas,12
usairway need actual person custom relat refund call disput charg credit card,16
usairway 2nd attempt call us airway dividend mile 52 minut help hung usairway bs,16
usairway claudoakeshott dont need link get person u say u dont know bag lost nonstop phx jfk,8
usairway absolut crap week,16
usairway tri get partner pnr spent 1 hour hold know snow somewher aw,5
usairway phone hour wait custom servic got wrong fight inform cost us 6 hour trip frustrat,5
usairway unit say luggag hold almost 35 hr usairway unit hung 3x,10
usairway cancel flight everi flight dont,17
usairway reserv phone number work call 10x last 3 day havent gotten,5
usairway americanair gold dividend member cant get anyon phone handl cancel flight american flight tonight,5
usairway realli nigga ur fuck boy,12
usairway sympath reweath issu time get tough call folk two hour hold 4minut fix fail,16
usairway plane ground longer air us5235,9
usairway fail day long blame americanair,10
usairway 1 hour count hold,5
usairway cancel flight amp reschedul flight amp still get updat amp cant find current flight account,5
usairway hour plane know maint issu ahead time announc anoth 30 min r plane,9
usairway accord wtop dca seem recov nice yesterday snow cancel flightl flight,17
usairway cancel flightl flight avail flight phl today u said sold buy 2nd ticket u need refund,17
usairway americanair serious servic issu right decid tweet unbeliev,3
usairway flight 4210 sit bradley_airport gate 27 10 min w door open sinc arriv still jet bridg someon help,9
usairway board plane know maint issu us5235,9
usairway wait day atl sinc flight cancel flightl 1 standbi told seat group 15 show late flight get phl,2
usairway link doesnt work,5
usairway spent 15 hour line tri get flight home tonight cancel flightl hour late flightr even snow dca,17
usairway flight 838 leav 6 hour mechan delay need lodg voucher meal tonight st thoma see,9
usairway care elabor cha dca cancel flightl even,19
usairway help im fall one plane,0
usairway worst fli experi guy need better,1
usairway go miss connect flight home delay gate agent get us planeso frustrat,2
usairway never fli guy custom servic aw,1
usairway tell man there flight next 10 hr standbi noth option tri get sick child firevan,13
usairway miss connect due delay la told look good tmrw either stuck clt help,2
usairway ur employe name van ticket counter philadelphia extrem rude father tri get home sick kid miss flight,19
usairway im stupid ive done web develop 19 yr issu confirm support websit,11
usairway offer provid us hotel anyth flight 19 hour away,3
usairway hang im start think person,18
usairway 140 charact yea right thank patron,0
usairway 30 min delay mechan replac rivet 30 min late flightr turn mechan wrong size rivet 35 min pathet,9
usairway would love could get wife home sometim soon stuck orlando stuck philli long,19
usairway churn rate increas second,9
usairway ive hold reserv desk 3 hour help,5
usairway servic philli unaccept look better servic 16 yr old shouldnt hard time,16
usairway phl btv today made deplan sunday dont know mainten avail,9
usairway thing nondelay flight na get shit togeth get,8
usairway todayno reason 4 anyon approv merger americanairoth airlin reason fear lose busi u,1
usairway custom servic philli deplor rude amp unprofession gate agent delay amp cancel flightat takingthistothetop,15
usairway look better servic,16
usairway mobil app horribl need major overhaul,5
usairway get better employe,12
usairway stuck tarmac 30 min phl wait someon load baggageridicul,9
usairway next time promis ontim departur stick instead stuf us sweat box air,19
usairway mrrenevendez ive tri contact 24 hour alreadi yesterday wait 7 hour today 5,5
usairway ye horribl snow serious hire peopl answer phone competitor call back number,0
usairway final count 3 hour 24 minut hold told need log us airway websit noth els done,5
usairway 4 hr count today alon like dont thing accomplish today keep hold,15
usairway claudoakeshott link work pl noth complet frustrat w usair last 12 hr,5
usairway link doesnt work mobil,5
usairway quit cheap hire call center employe shouldnt take half day call,0
usairway cancel flight reschedul said id pay 75 earlier flight next gate today delta proactiv offer 0,17
usairway corybronz inconveni peopl freak nut guy two kid strand airport fail,2
usairway delay flight phil stt look like well miss car ferri john lodg help hous,12
usairway thehaileyt anoth blatant lie usairway,18
usairway round two worst airlin ever,1
usairway tri get repres 7 hour aboout cancel flightl flight simpli given,2
usairway josephtrei cant believ advic call custom servic hold 3 hr morn final gave,5
usairway pretti upset drove philli mhtt still info bag what deal,16
usairway comcast airlin 2hrs35minonhold,15
usairway thank americanair respons amp found altern travel home,12
usairway luggag content destroy outbound trip last weekampinbound lastnight philadelphia careless,19
usairway plane sit one go home usairwaysfail,15
usairway josephtrei dont bother dont pick phone worst custom servic go,16
usairway overload small plane extra baggag take poor execut 4435 75 minut delay,15
usairway might possibl worst airlin ever think time brush custom servic sorud,16
usairway embarrass us air inabl manag weather delayshandl 4435 exampl,15
usairway bag flight 1898 clt jfk land last night midnight,4
usairway impress custom servic everyon unhelp incred rude,12
usairway 45 minut move two feet bze,16
usairway hold 2 hour 54 minut what go,5
usairway theyr even accept call come,16
usairway worst custom servic ever,1
usairway three hour delay miami london none flight today delay put anoth flight,2
usairway extrem weather miami pick phone hire peopl,4
usairway 2 hour 14 minut hold count thank help customerservic brutal,5
usairway uh yeah flight board amp 1 hr late flightr still sit updat 4435 dca,15
usairway get home syracus 6 cancel flightl flight one rout three us sit charlott,17
usairway british_airway three hour flight delay phone 45min count,5
