documento,topico
southwestair brittanyobx11 keep famili apart w quirki archaic polici airlin accommod situat,16
southwestair report file would like support activ search feel pretti passiv info comput preciou,15
southwestair surpris surpris delay seem norm broken equip,19
southwestair doesnt mean tsa precheck show mobil board pass ktn link account,5
southwestair flight hrl limit rout,19
southwestair inflight wifi absolut worst id will paid doubl dialup speed flight7,8
southwestair ye know also notic offer list board a60 program popular,4
southwestair pay servic deliv whether fault shouldnt sort compens,13
southwestair littl surpris earli bird got b15 den kc worst ive what,19
southwestair got dupe w connect 1st flight sneaki u wont give seat earlier flight w avail shame,17
southwestair real sincer apolog make day glad know fli mail import never fli sw badservic,8
southwestair alreadi follow cant dm u need follow back,19
southwestair rude custom svc wont accommod earlier flight wo 400 charg us mail take prioriti custom badservic,17
southwestair rude gate agent wholli unaccept us amp passeng think last time sw,15
southwestair troubl reflight book problem cancel flight flight one pick phone site isnt work,2
southwestair pleas hire effici consult manag phx baggag checkin way mani open kiosk 100 ppl wait,1
southwestair everi flight flown personallyabout two round trip per month full still hard believ fli 8 hour thru atlno,18
southwestair jlittle100 doubl comment phl anywher south florida gone gone gone hello us air,15
southwestair dont like new schedul nonstop phl fll pbi free move citi sad,19
southwestair incred frustrat email still havent receiv respons,8
southwestair paid inflight wifi work download speed 021mbp amp end watch free tv instead,8
southwestair wish wouldv known couldv slept 2 hour let friend know wait land,7
southwestair noth express express bag drop phoenix sky harbor,18
southwestair use exclus fli sw late flightli direct flight amp cheaper cost switch whyso fewdirectflight,12
southwestair email address send thought experi realli good amp feedback,7
southwestair great flight delay three hour friend wait airport hour birthday,2
southwestair thirty_l birthday 24th he see imagin dragon destinationdragon,19
southwestair friend lucki enough see destinationdragon live birthday he fan year thirty_l,7
southwestair enter everi contest destinationdragon lose,11
southwestair main support play jesu portray homosexu partner juda perform gay wed boycott,19
southwestair your give everyon tix destinationdragon except birthday,11
southwestair sent conf number yesterday,0
southwestair well fun last happi chang redeem reward point wont loyal anymor,11
southwestair delay flight 423 bdl mco need get florida amp race daytona,15
southwestair learn give folk multipl flight day board posit least cant give board pass,14
southwestair im get leatheri heat 4251 even get vega,19
southwestair first flight ever flight 4251 alreadi technic issu faaaannntast,2
southwestair feel flight 4251,19
southwestair stuck 4251 heat blast tri thaw water line kinda disappoint first flight rr member,13
southwestair love friendli staff ask updat delay flight caus miss connect horribleattitud,2
southwestair hate guitar player chgd overs extra bag acoust guitar epic fail,19
southwestair flt 463 san jose ca gt denver co delay 2 hr easili best flight touchdown year fli keep,1
southwestair spoke soon bag lost,0
southwestair humor asid weve stuck plane two hour gate bag cant load correctli give,9
southwestair weve sit gate two hour wait bag load im tell herb,9
southwestair rude gate agent bwi tonight gate b8 65hr delay flight 1172 think littl train order,17
southwestair sat plane 2 hr 215 final took,9
southwestair flight cancel flight tonight told wont receiv travel voucher inconveni realli polici,17
southwestair fli swa lot alway purchas eb never past a30 rethink swa process mislead,14
southwestair today sporad chang flight departur 5 time amp left two hour late flight uncharacterist u,2
southwestair ye extra 77 wonder go yo loos room,6
southwestair flight oakland sna 730 ask take 530 even 5 empti sest answer,16
southwestair could care custom reason request,0
southwestair go stop fli delay everytim time due paperwork,9
southwestair thnx hope nxt flight ive got 3 show wknd worst case ill turn sweatshirt insid,10
southwestair receiv bad custom servic end spend sever hundr dollar accommod famili cxl flight,1
southwestair keep say mobil board pass unavail despit check everyth,4
southwestair app isnt work take like two hour help,5
southwestair cant take knoxvil yall fav help,14
southwestair understand weather fault frequent flyer expect better custom servic ill tri delta,13
southwestair flight 952 leav la vega 540pm arriv chimid 1100 pm,19
southwestair doesnt even gluten free peanut whyyi,14
southwestair pleas updat websit,5
southwestair kaneshow internjohnradio mrerickv everyth return jet go miami,11
southwestair inclement weather flight left dca today plane appear come au,15
southwestair leeannhealey yeah sale fare got place fli oh damn right live swa doesnt fli,6
southwestair took age one snapchat stori load one one demolish,4
southwestair lost sunglass amp case flight 3933 last night lost amp found,13
southwestair wifi shit fix jump closest bloodi fuck emerg exit,14
southwestair need help chang name compani reservationw tri call custom relat busi signal,5
southwestair ala pretti full entertain witti reparte,6
southwestair tri book anoth flight appli credit anoth flight cant find,2
southwestair frustrat experi southwest 18 hour trap denver bc mechan problem worstcustomerservic,19
southwestair weve lost whole day honeymoon disappoint frustrat everyth,8
southwestair stay chicago overnight meet bag hope stay put dont get put flight,8
southwestair bicycl 62 50lb criteria free bike automat 75each way faq page isnt clear,11
southwestair wonder reason custom servic busi hold past day mani hour answer help plz,5
southwestair open kiosk austinbergstrom three lane servic line 50 peopl realli,18
southwestair pl help get resolv amp reimburs made gracia rico pl send privat msg phone number email address,10
southwestair alist prefer line phone wait 15 minut hung feel alistey,15
southwestair stop get credit card app alreadi card,19
southwestair tsa pre isnt show board pass ive follow step pleas help,5
southwestair guy fuck never forgiv,1
southwestair im smash window giant guest sit next 4386 way guy given 1 seat,3
southwestair im miser orlando vega nonstop right big must guest u requir 2 seat im 1a btw,8
southwestair bad weather multipl cancel flight flight us scare note next time,17
southwestair good know three set travel 20 min stand wait min pass,9
southwestair doesnt want deal world might want know treat custom,0
southwestair guess get airport earli need wait 10min checkin realli,10
southwestair worstthingev 2day late flightr lost bag fedex somewher know caus dont amp deliv somewher,0
southwestair know inform found peopl account see someon els reserv rr trip,5
southwestair dont confer number spoke courtney texa david final fix mine hour,9
southwestair custom servic said known problem use confirm number domest intern,16
southwestair look like 1 yr anni trip replac w someon itinerari worri abt c flight,9
southwestair would want last time screw earli board paid,17
southwestair jamesasworth worst corpor account manag 22 brent take 70plu flight delta thank,1
southwestair complet horror show flight bump three time today noon run airlin cantblametheweath,15
5 hour delay shortlysouthwestair brendanpshannon brendan sorri keep wait well air shortlyr,2
southwestair step 1 less shot step 2 acknowledg custom place twitter step 3 dont suck much,6
southwestair im sorri stray go americanair ive learn lesson attend need sw happi,19
southwestair poor custom servic problem,16
southwestair one look like problem fix,19
southwestair 3 day amp still home even ground 3 day pastmypatienceexpirationd,14
southwestair understand much often seem like quick request desk take question ask,19
southwestair tri enter rapid reward contest link facebook browser kept pop secur warn 4,11
southwestair ohe text messag receiv entitl jackass friend,6
southwestair pre board process work basic anyon doesnt want wait turn get slip,14
southwestair oki forgiv guy,1
southwestair delay 355 get yell attend bother get wors,2
southwestair southwest schedul fli costa rica march 7 cant book onlin avail,11
southwestair servic rep didnt say dumb tone voic like known,16
southwestair would nice could talk agent rather get caught w promot amp hung,2
southwestair want southwest know dont think theyr great use anymor noth look,0
southwestair custom relat line busi signal call normal line servic rep thought dumb know,16
southwestair didnt see travel compet unus fund expir date hidden fine print never saw,14
southwestair long wait hour mother bag make file report wait thank help,10
southwestair sw return custom servic busi travel made sw sw ignor us,2
southwestair app repeatedli crash fail display name check unabl use app,5
southwestair,11
southwestair yea hope avoid ticket differ amount birthday courtesi flysouthwest lovesouthwest mybday,17
southwestair sagerooski amp use luggag scale measur weight loss one scale foot home accur anymor,0
southwestair board plane told get wasnt plane hour delay,9
southwestair two hour plane gate undignifi behavior apolog isnt enough freedrinkcoupon,9
southwestair cut peopl 35 minut flight time check bag flight delay 2 hour wait 8 hr,5
southwestair want file formal complaint disgruntl employe laguardia ruin mltple peopl travel plan yesterday,13
southwestair hi got tsa precheck amp put acct board pass flight pmcan updat,17
southwestair mdw gate mani fewer seat plane,7
southwestair realli 15 hour plane gate jax2bna like havent wait day get home notokay,10
southwestair option cancel flight dont want chang flight want cancel flight,17
southwestair lastli compani that tri put love fli would nice someon person address concern,7
southwestair flight 2078 balt hit turbul babi cri kid vomit chao flight attend carolin superhero,8
southwestair way flight number 1703 pleas feel free fact check complaint leav time amp baggag time,0
southwestair therefor sinc ive receiv recours phone submit email complaint amp letter via mail follow,7
southwestair consid loyal custom brand im astound lack concern custom fli experi,1
southwestair experi wors fli experi ive ever met w contempt custom servic make wors,1
southwestair pleas let noth overhead bin exit first fli lot bring purs tire run connect,19
southwestair request refund reward point use purchas flight refus,11
southwestair today call custom servic amp speak wendel holton dalla offic amp told noth,13
southwestair get singl answer southwest personnel hour wait apolog explan,19
southwestair along passeng repeatedli ask southwest personnel take long luggag,10
southwestair next arriv atlanta wait full hour luggag place carousel one hour,10
southwestair secondli begin board time despit aircraft present deplan thu left 30 min late flight,13
southwestair 2 bag fli free what carryon packingayak brianregancom,8
southwestair first cockroach crawl counter gate visibl mous trap seat gate,16
southwestair complet displeas servic receiv yesterday fli lga atl,7
southwestair accept reserv past august 7,5
southwestair fs4ve7 correct attend error gave attitud made rude show take back nutsamp said well late flight,12
southwestair sent screen shot incid report,0
southwestair couldnt fli today amp made trip harder pay check bag devotedyyour today,12
southwestair flight 4110 mco isp delay detail,2
southwestair flight 630 fll kiosk open rude attend everyon late flight,2
southwestair websit downnnnn ugh,17
southwestair pleas tell ill make flight tomorrow 8am ive tryin 3 day leav,17
southwestair bad experi last week broke bicycl brought bike ride fla,16
southwestair tinaisback im sorri frustrat get rebook sw ive rebook 4 time still stuck smh,19
southwestair 75 minut still wait ski unload asham 130 morn,11
southwestair bag tv show film,10
southwestair schedul morn 2 day fact yesnot sure even flight one cancel flightl,17
southwestair updat 35 minut pilot turn ac longer freez enjoy wait reload bag,17
southwestair seem odd sit plane get delay find txt 6 emp work aircraft,8
southwestair realli enjoy sit bwi door wide open ac fix baggag error sarcasm,14
southwestair engadget theverg wire reddit,11
southwestair male flight attend must play game call bigger dick peopl flight 952 chimid,12
southwestair your hold southwest 2 hour automat hang iusedtoloveu,17
southwestair 3rd cancel flightlat 2 day due weather nashvil 3 trip airport time commun late flight sw,2
southwestair left ipad flight 1831 erw den open claim 442998 mani memori plz help get back,8
southwestair ye dale baggag offic wonder everyon page 6 hour wait,18
southwestair one want commit say plane get cancel flight custom relat close patienc gone,16
southwestair tri leav monday plane left mine one keep get delay miss work pay cab,2
southwestair luggag still found luggag scan final destin way know,10
southwestair final got 3 hour set thank,5
southwestair dishearten experi familyand lot taxi money wast,5
southwestair pleas help hold forev check flight,5
southwestair sister famili drive 1200 mile accommod rebook time manner horribl,17
southwestair cant believ mani pay custom left high dri reason flight cancel flightlat monday bdl wow,17
southwestair appreci rude doesnt solv much least cover cost stolen good,11
southwestair your 44 blow custom servic shotwest airlin,16
southwestair made standbi flight cancel flight reason almost 4hr late flight conf fvf9yw swrr 298033455,11
southwestair frustrat custom serviceopen seat earlier flight 154 chang rip,17
southwestair 40 pleas start act age stop shortshort,10
southwestair self help way put tsa pre check number exist reserv annoy 800 reachabl,5
southwestair wont let leav newark,17
southwestair nashvil drive 3 half hour memphi made plane load,9
southwestair accord tv passeng interview land far unev heavi panic break,11
southwestair chanc cancel flight flight nashvil,17
southwestair airlin cancel flight flight bna strand philli 2 day hope get,17
southwestair help tri get nashvilleshould waiv chang fee 218,11
southwestair thank told couldnt hour ago plane left tri stuck wait hour,5
southwestair took carryon bag essenti attir life chang interview tomorrow amp expect compens,13
southwestair took bo bwi plane flight stl promis replac 15 hour late flightr 25 hour delay happi,2
southwestair larg group major 30 bag soak,4
southwestair even 50 voucher pick bag,18
southwestair first interact peopl morn bad weather sorri wont fli,17
southwestair yeah told would next flight drove wasnt drove second time,14
southwestair let dm,19
southwestair im pray get home aliv,19
southwestair hope your happi offici becom next americanair profitbeforepeopl imo bankrupt 2020,16
southwestair what delay throw prioriti board way amp ill forgiv southwest southwestairlin,18
southwestair need flight info add rapid reward flight first time flown sw wont mad,19
southwestair keep get disconnect choos option unus travel fund autom custom servic line so,16
southwestair old miss connect sleep oak get hotel dime rub wrong way wasnt late flight,1
southwestair finest moment boston right,9
southwestair bag 1st woman said would next flight ive got noth big wig help,11
southwestair thank think straight,6
southwestair paid 200 rental car go 3rd day,12
southwestair thank expect wait long,10
southwestair understand weather issu time cancel flight reinstat cancel flight hardli updat noth,17
southwestair sadli didnt get much help travel agent disappoint,14
southwestair bo msp msp au au bo site doesnt seem display field middl trip add 3rd,5
southwestair abl rebook anoth flight drove atl catch flight charg 40 get group,17
southwestair worst custom servic earth never fli airlin,1
southwestair flight yesterday cancel flight got airport 4am today time flight w delay cancel flight reinstat caus,17
southwestair flight 4968 n8325d depart mco enrout no_airport,11
southwestair poisonpill76 im boat 8am flight jacksonvil get,17
southwestair im concern cancel flight flight bna tomorrow,17
southwestair stop ur bs promo anywher start 79 click everywher id fly130 place that 79 cle nothank,8
southwestair know one thing delta would never treat custom like,0
southwestair yall tri fli chicago dont live send home bullshit ass custom servic,6
southwestair 4 flight cancel flightl one week custom servic,17
southwestair 4 flight cancel flightl yall im sick,17
southwestair poor custom servic thru cxl flight shouldv flew delta,6
southwestair what yall corpor number bc yall tri accommod,19
southwestair cant checkin onlin 200 flight tmrw fr cancun undefin error amp 800 workingfamili 4 dont want cgroup help,3
southwestair anyon ever answer phone poor,5
southwestair 2 min departur 4125 announc updat updat time statu everyon stand comeon,15
southwestair get kind updat delay flight boston houston 730 realli need back home tonight,8
southwestair matt_e_boss long hold wait 35 minut gave,5
southwestair plan make southwest app android crappi,19
southwestair thank take good care luggag,6
southwestair yeah 4 rebook tomorrow hope 3rd time charm cancel flightl flight,17
southwestair make premium wifi pay 30 decent slowfi,16
southwestair extrem disappoint poor custom servic provid cancel flight flight today unprofession,16
southwestair help nice ladi phx checkin spent 4 hour hold 24 hour might want look effici,16
southwestair told last time would never fli realli mess today thank flight 1802 worst airlin ever,1
southwestair done mess plan trip costarica penni vacatim,14
southwestair sorri sat plane 3 hour wait engin fix got luggag lost k,10
southwestair show one flight one way tri go home page book roundtrip there noth avail,19
southwestair need help cancel flight flight back call time ridicul,17
southwestair custom servic terribl your terribl thought know,16
southwestair pt expir made prchase onlin retail b told sw wont show 68 wk l8 2 keepmi pt,11
southwestair offici worst custom servic airlin ive ever dealt southwestairlin poor,1
southwestair fastest respons day hour phone never got hold hour line never got flight book problem desk,5
southwestair rebook atlanta amp drive nashvil pay ridicul price differ bad weather good busi,17
southwestair flight 1613 cancel flightl wife stuck phoenix way slc san thank lot southwest,1
southwestair never got cancel flightlat text morn either bushleagu number call weakservic,16
southwestair late flight,2
southwestair serious wtf nochil,9
southwestair ye couldnt explain 2 hour 45 minut hold time,5
southwestair mcogtdca flight almost full peopl screw msydca cancel flightat unit usairway didnt cancel flight swamistak,14
southwestair charg station san,11
southwestair 4914 need fli gsp dsm claim there sched avail book separ togeth,15
southwestair thank hung 1hr 7min hold would like dm contact info,19
southwestair checkin system poor,14
southwestair troubl check pleas add dm,19
southwestair wifi yesterday flight extrem slow wast 8 lost travel time work,14
southwestair flight cancel flightl monday look cancel flight credit card that,17
southwestair still ground gt30min plan departur california weather origin told 10 min delay,6
southwestair yet suppos get earli even tonight dont want go store buy new necess,17
southwestair possibl call swa phone put hold hour cut,5
southwestair nashvil airport runway open appear southwest airlin cancel flight flight like chang,11
southwestair phone hour waitingcan pleas answer thank notcool,5
southwestair she still strand dc sat 330am 100 kid starv exhaust,4
southwestair flight 211pilot spill tea radio yay delay almost hour,5
southwestair sent,19
southwestair use love keep reschedul flight southworst,5
southwestair start ive alreadi wast 15 hr phone wait time alreadi,5
southwestair brother amp girlfriend flight cancel flightl 3 time leav 72 hour late flight drop letter grade school help,18
southwestair cancel flightl flight bna flight bna 2 mdw tomorrow strand den ive hold day,17
southwestair miss 6000 point one account theyr spread four assum creat account,19
southwestair right point kid dont fli often bought four round trip ticket dtw phx im,11
southwestair pleas pm number lodg formal complaint thx,0
southwestair good thing notic rerout 7 total passeng imposs tripl connect well,15
southwestair gate agent rerout imposs itinerari find new airlin get us home super bum,14
southwestair auto callback dont wait hold,19
southwestair receiv email wreso email isnt associ swa account cc info sister fraud pleas dm,19
southwestair onboard wifi bad take 20 minut send tweet work tabl disappoint,8
southwestair recommend upgrad ivr use call back email text know caller,14
southwestair entir flight luggag miss dca hour nobodi know anyth,17
southwestair cbssoxfan get hold call twice kick offcal 36 phonedi alistpref,7
southwestair airlin fli bna today,11
southwestair spent 87 minut count hold w today first 48 minut gave tri amp 43rd min,5
southwestair ive airlin everyon els great sour whole experi hope she next time,1
southwestair think im shot cant find flight arriv busi san thu realli want go,13
southwestair woman work counter philli 630 need fire due bad weather along passeng,9
southwestair earlier reflight book problem flight im didnt get screencap said unspecifi error call swa,2
southwestair buy earli bird pointless move diff flight bc first one delay lost board posit,17
southwestair problem websit tri make chang w app site got unspecifi error,5
southwestair super disappoint today first time weve stress book flight anoth airlin airport,19
southwestair put next flight avail tomorrow morn idea bna open morn flight,17
southwestair hey swair tortur board flight 1971 due one gate agent board assist folk one time,19
southwestair understand delay stuck plane longer flight unaccept,19
southwestair 30 year fli never piss mani incid one flight,1
southwestair heard apolog 45 time gt60 min hold fli anoth airport differ time delay,0
southwestair willmak sure tell everyon know around horribl experi also post busi page,4
southwestair current im bring 3 year old bathroom im rush flight attend,8
southwestair terribl inspir call custom servic futur,16
southwestair also said couldnt even book flight put hold amp someon els,5
southwestair person talk couldnt anyth normal avail onlin charg part,6
southwestair someon help set callback today,15
southwestair cancel flightlat link rebook like initi storm issu,17
southwestair realli guidanc call via phone back log could done onlin 3 minut,0
southwestair rebook flight board bham,17
southwestair pleas send number call talk person put hold,5
southwestair flt 648 buf mco conffgkxv5 pleas also look reimburs car 587701925count cancel flight,17
southwestair almost 2 hour hold need cancel flight flight get refund airlin oper,17
southwestair need accommod loyal custom happi,17
southwestair bernhardtjh eventu get flight cancel flightl decid drive gave hold process refund,17
southwestair worst custom servic terribl attitud dont care big storm employe need attitud adjust,1
southwestair flight cancel flightl bna reschedul travel fund put back account futur use,14
southwestair kid need help yesterday im land wait connect never fli southwest,1
southwestair bag back ding,0
southwestair yeah bruh bool yall niggaz need hire worker someth caus next time imma forc ta disrespect,6
southwestair tri add dog flight cant get,5
southwestair need request refund flight cancel flightl morn due weather,17
southwestair twitter say cant dm someon unless follow southwestair follow twitter thank,19
southwestair thank twitter say cant dm someon unless follow southwestair follow twitter,19
southwestair follow flight cancel flightl cant rebook onlin hold 2 hour would love dm flight info thank,17
southwestair also find ridicul ive tweet sinc 350 est still receiv respons 9 hour,5
southwestair thank ye got biggest frustrat im longer abl check onlin flight 4 cancel flight,17
southwestair flight still get logan couldnt manag get one 6 wasnt snow,8
southwestair 45min wait phone option callback final hang phone die customerservic,5
southwestair flight nashvil today kid airlin fli your frustrat,11
southwestair im tri chang famili vacat due measl outbreak havent abl get anyon phone help,5
southwestair challemann fli lga dead winter jvstatu ewr amp jfk alway intellig option,15
southwestair need reschedul flight ive hold almost hour ridicul best number call,5
southwestair condescens must qualiti co reward tone reek,19
southwestair disappoint custom servic right flight one cancel flightl airport amp im lose 2 day trip,18
southwestair hold hournot cool guy,1
southwestair ive hold hour amp half tri chang flight bna happi custom servic right,13
southwestair thank given repli 2 year ago direct area learn improv,8
southwestair disconnect call 25 hour without even speak octaviannightmar,5
southwestair injur check yesterday u told go dr hold swa hour tri talk someon suggest,10
southwestair tri get phone confirm fund cancel flightl reserv still use futur u help,5
southwestair consid ad well call back someon free featur support line,7
southwestair ive hold custom servic hour help,5
southwestair ive hold hour 5957 type ridicul need link chart rout time,5
southwestair flight cancel flightl reflight book problem onlin work second round hold 3 hr option,2
southwestair kudo rsw cs crew rerout pax allevi sale due grade eqp 800 500,14
southwestair tri get custom destin help get anoth airlin flight 3 day,5
southwestair im alist prefer custom loyal swa howev inflight wifi better today 4 year ago,8
southwestair bad im get memo reserv contain modif prevent chang onlin fustur,9
southwestair almost 2 hour hold 2 hour life cant get back thank,5
southwestair discount three delay,19
southwestair tri onlin told must call bc modif reserv hold almost 2 hour,5
